{
  "schema": "pto.ndf-supplements.v1",
  "non_normative": true,
  "surface": "scalar",
  "chunk": 1,
  "entries": [
    {
      "id": "PTO-ACRC-DECISION-BINDING-001",
      "source_path": "asl/scalar/sys/ACRC.asl",
      "title": {
        "en": "ACRC instruction contract",
        "zh-CN": "ACRC 指令契约"
      },
      "summary": {
        "en": "This clause anchors the complete ACRC contract in its owning ASL, covering the context-close request, final-position marker, legality, ordering, and fault boundary. Implementers can trace every accepted ACRC decision to one executable operation.",
        "zh-CN": "本条把 ACRC 的完整契约集中到所属 ASL，涵盖上下文关闭请求、末尾位置标记、合法性、执行顺序和异常边界。实现者可由此把所有已接受的 ACRC 决策追溯到唯一的可执行操作。"
      }
    },
    {
      "id": "PTO-ACRE-IMPLICIT-STOP-001",
      "source_path": "asl/scalar/sys/ACRE.asl",
      "title": {
        "en": "ACRE implicit SYS-block stop",
        "zh-CN": "ACRE 的 SYS Block 隐式停止"
      },
      "summary": {
        "en": "This clause defines ACRE as the terminating operation and implicit stop of an active SYS block. It also exposes the observable sequence: validate without mutation, commit the block, then atomically consume and restore the saved context; reserved request values have no recovery effects.",
        "zh-CN": "本条说明 ACRE 是活动 SYS Block 的终止操作和隐式停止点。其可观察顺序为：先无副作用地验证，再提交 Block，最后原子地消费并恢复已保存上下文；保留的请求值不会产生恢复效果。"
      }
    },
    {
      "id": "PTO-ADD-DECISION-BINDING-001",
      "source_path": "asl/scalar/alu/ADD.asl",
      "title": {
        "en": "ADD instruction contract",
        "zh-CN": "ADD 指令契约"
      },
      "summary": {
        "en": "This clause anchors ADD assembly, encoding legality, operand transformation, fixed-width addition, destination publication, ordering, and faults in the owning ASL. It gives implementers one executable source for the instruction's observable result and retirement behavior.",
        "zh-CN": "本条把 ADD 的汇编形式、编码合法性、操作数变换、定宽加法、结果发布、执行顺序和异常边界集中到所属 ASL。实现者可从这一处获得指令结果和退役行为的可执行依据。"
      }
    },
    {
      "id": "PTO-ADDTPC-PAGE-001",
      "source_path": "asl/scalar/bru/ADDTPC.asl",
      "title": {
        "en": "ADDTPC page-relative value",
        "zh-CN": "ADDTPC 页相对值"
      },
      "summary": {
        "en": "This clause describes ADDTPC as a value-producing page-relative calculation from the current instruction TPC. The signed immediate is scaled by 4 KiB and wraps at XLEN; the result goes through Reg5 without installing a control-flow target or directly changing TPC.",
        "zh-CN": "本条说明 ADDTPC 以当前指令 TPC 为基准生成页相对数值。带符号立即数按 4 KiB 缩放并在 XLEN 宽度回绕，结果经 Reg5 发布，但不会安装控制流目标，也不会直接修改 TPC。"
      }
    },
    {
      "id": "PTO-AND-DECISION-BINDING-001",
      "source_path": "asl/scalar/alu/AND.asl",
      "title": {
        "en": "AND instruction contract",
        "zh-CN": "AND 指令契约"
      },
      "summary": {
        "en": "This clause anchors AND assembly, encoding legality, right-source transformation, bitwise conjunction, destination publication, ordering, and faults in the owning ASL. It keeps the observable result and retirement boundary tied to one executable definition.",
        "zh-CN": "本条把 AND 的汇编形式、编码合法性、右操作数变换、按位与、结果发布、执行顺序和异常边界集中到所属 ASL，使可观察结果和退役边界始终对应同一份可执行定义。"
      }
    },
    {
      "id": "PTO-BCNT-DECISION-BINDING-001",
      "source_path": "asl/scalar/alu/BCNT.asl",
      "title": {
        "en": "BCNT instruction contract",
        "zh-CN": "BCNT 指令契约"
      },
      "summary": {
        "en": "This clause anchors the complete BCNT contract in its owning ASL. The executable definition selects a wrapping scalar field, counts its set bits, publishes an XLEN result, and defines all legality, ordering, and fault boundaries.",
        "zh-CN": "本条把 BCNT 的完整契约集中到所属 ASL。可执行定义负责选择可回绕的标量位域、统计置位数、发布 XLEN 结果，并界定合法性、执行顺序和异常边界。"
      }
    },
    {
      "id": "PTO-BIC-DECISION-BINDING-001",
      "source_path": "asl/scalar/alu/BIC.asl",
      "title": {
        "en": "BIC instruction contract",
        "zh-CN": "BIC 指令契约"
      },
      "summary": {
        "en": "This clause anchors the complete BIC contract in its owning ASL. It ties wrapping-field selection and bit clearing to the instruction's encoded legality, XLEN result, destination effects, ordering, and faults.",
        "zh-CN": "本条把 BIC 的完整契约集中到所属 ASL，将可回绕位域选择和清零操作与编码合法性、XLEN 结果、目的操作、执行顺序及异常边界绑定在一起。"
      }
    },
    {
      "id": "PTO-BIS-DECISION-BINDING-001",
      "source_path": "asl/scalar/alu/BIS.asl",
      "title": {
        "en": "BIS instruction contract",
        "zh-CN": "BIS 指令契约"
      },
      "summary": {
        "en": "This clause anchors the complete BIS contract in its owning ASL. It ties wrapping-field selection and bit setting to the instruction's encoded legality, XLEN result, destination effects, ordering, and faults.",
        "zh-CN": "本条把 BIS 的完整契约集中到所属 ASL，将可回绕位域选择和置位操作与编码合法性、XLEN 结果、目的操作、执行顺序及异常边界绑定在一起。"
      }
    },
    {
      "id": "PTO-BSE-DECISION-BINDING-001",
      "source_path": "asl/scalar/sys/BSE.asl",
      "title": {
        "en": "BSE instruction contract",
        "zh-CN": "BSE 指令契约"
      },
      "summary": {
        "en": "This clause identifies the owning ASL as the complete BSE contract for publishing a nonblocking SendEvent execution-control request. The same owner defines accepted encodings, state effects, ordering, and rejection behavior.",
        "zh-CN": "本条确定所属 ASL 是 BSE 发布非阻塞 SendEvent 执行控制请求的完整契约来源，并由同一处定义可接受编码、状态影响、执行顺序和拒绝行为。"
      }
    },
    {
      "id": "PTO-BWE-DECISION-BINDING-001",
      "source_path": "asl/scalar/sys/BWE.asl",
      "title": {
        "en": "BWE instruction contract",
        "zh-CN": "BWE 指令契约"
      },
      "summary": {
        "en": "This clause identifies the owning ASL as the complete BWE contract for publishing a nonblocking WaitEvent execution-control request. The same owner defines accepted encodings, state effects, ordering, and rejection behavior.",
        "zh-CN": "本条确定所属 ASL 是 BWE 发布非阻塞 WaitEvent 执行控制请求的完整契约来源，并由同一处定义可接受编码、状态影响、执行顺序和拒绝行为。"
      }
    },
    {
      "id": "PTO-BWI-DECISION-BINDING-001",
      "source_path": "asl/scalar/sys/BWI.asl",
      "title": {
        "en": "BWI instruction contract",
        "zh-CN": "BWI 指令契约"
      },
      "summary": {
        "en": "This clause identifies the owning ASL as the complete BWI contract for publishing a nonblocking WaitInterrupt execution-control request. The same owner defines accepted encodings, state effects, ordering, and rejection behavior.",
        "zh-CN": "本条确定所属 ASL 是 BWI 发布非阻塞 WaitInterrupt 执行控制请求的完整契约来源，并由同一处定义可接受编码、状态影响、执行顺序和拒绝行为。"
      }
    },
    {
      "id": "PTO-BWT-DECISION-BINDING-001",
      "source_path": "asl/scalar/sys/BWT.asl",
      "title": {
        "en": "BWT instruction contract",
        "zh-CN": "BWT 指令契约"
      },
      "summary": {
        "en": "This clause identifies the owning ASL as the complete BWT contract for publishing a nonblocking WaitTimeout execution-control request. The same owner defines accepted encodings, state effects, ordering, and rejection behavior.",
        "zh-CN": "本条确定所属 ASL 是 BWT 发布非阻塞 WaitTimeout 执行控制请求的完整契约来源，并由同一处定义可接受编码、状态影响、执行顺序和拒绝行为。"
      }
    },
    {
      "id": "PTO-BXS-DECISION-BINDING-001",
      "source_path": "asl/scalar/alu/BXS.asl",
      "title": {
        "en": "BXS instruction contract",
        "zh-CN": "BXS 指令契约"
      },
      "summary": {
        "en": "This clause anchors BXS field selection, extraction, sign extension, destination publication, legality, ordering, and faults in the owning ASL. The observable result is an XLEN value derived from the selected wrapping field.",
        "zh-CN": "本条把 BXS 的位域选择、提取、符号扩展、结果发布、合法性、执行顺序和异常边界集中到所属 ASL。可观察结果是由选定可回绕位域得到的 XLEN 数值。"
      }
    },
    {
      "id": "PTO-BXU-DECISION-BINDING-001",
      "source_path": "asl/scalar/alu/BXU.asl",
      "title": {
        "en": "BXU instruction contract",
        "zh-CN": "BXU 指令契约"
      },
      "summary": {
        "en": "This clause anchors BXU field selection, extraction, zero extension, destination publication, legality, ordering, and faults in the owning ASL. The observable result is an XLEN value derived from the selected wrapping field.",
        "zh-CN": "本条把 BXU 的位域选择、提取、零扩展、结果发布、合法性、执行顺序和异常边界集中到所属 ASL。可观察结果是由选定可回绕位域得到的 XLEN 数值。"
      }
    },
    {
      "id": "PTO-C-CMP-EQI-DECISION-BINDING-001",
      "source_path": "asl/scalar/bru/C.CMP.EQI.asl",
      "title": {
        "en": "C.CMP.EQI instruction contract",
        "zh-CN": "C.CMP.EQI 指令契约"
      },
      "summary": {
        "en": "This clause anchors the compressed equality-with-immediate comparison in its owning ASL, including encoded operands, boolean result publication, ordering, and faults. It prevents the comparison form from being defined independently of its executable operation.",
        "zh-CN": "本条把压缩的立即数相等比较集中到所属 ASL，涵盖编码操作数、布尔结果发布、执行顺序和异常边界，避免该比较形式脱离可执行操作而被单独解释。"
      }
    },
    {
      "id": "PTO-C-CMP-NEI-DECISION-BINDING-001",
      "source_path": "asl/scalar/bru/C.CMP.NEI.asl",
      "title": {
        "en": "C.CMP.NEI instruction contract",
        "zh-CN": "C.CMP.NEI 指令契约"
      },
      "summary": {
        "en": "This clause anchors the compressed inequality-with-immediate comparison in its owning ASL, including encoded operands, boolean result publication, ordering, and faults. It prevents the comparison form from being defined independently of its executable operation.",
        "zh-CN": "本条把压缩的立即数不等比较集中到所属 ASL，涵盖编码操作数、布尔结果发布、执行顺序和异常边界，避免该比较形式脱离可执行操作而被单独解释。"
      }
    },
    {
      "id": "PTO-C-EBREAK-CAUSE-001",
      "source_path": "asl/scalar/sys/C.EBREAK.asl",
      "title": {
        "en": "C.EBREAK trap cause",
        "zh-CN": "C.EBREAK 陷阱原因"
      },
      "summary": {
        "en": "This clause explains how C.EBREAK exposes its encoded immediate through the software-breakpoint trap. Trap 50 receives the zero-extended five-bit value in the 24-bit cause field, with no separate architectural breakpoint-tag state.",